{
  "schema": "copilot-extensions.progressive-context-evidence",
  "version": 1,
  "runId": "f2-repo-conditional-flat-one-guide-r2",
  "variantId": "f2-repo-conditional-flat",
  "taskId": "one-guide",
  "model": "auto",
  "venue": "acp",
  "boundary": "fresh",
  "repetition": 2,
  "initialContext": {
    "unicodeCharacters": 4251,
    "utf8Bytes": 4251,
    "estimatedTokens": 1063
  },
  "firstTurnCorrect": false,
  "requiredGuideIds": [
    "runtime-diagnostics"
  ],
  "observedGuideIds": [
    "command-reference",
    "runtime-diagnostics"
  ],
  "autoLoadedGuideIds": [],
  "irrelevantGuideReadCount": 1,
  "turnCount": 1,
  "toolCallCount": 8,
  "elapsedMillisecondsBeforeGroundedAction": 64000,
  "pathResolutionFailureCount": 0,
  "missingPathCount": 0,
  "inventedPathCount": 0,
  "ownerProvenanceRetained": true,
  "criticalRuleViolationIds": [],
  "structuredRenderHash": "ceb4c2d9a9123c7b30a6ffa1a19d28cc592e0195d3312f89b40ecd1548eee9af",
  "selectedContributorIds": [
    "synthetic-publication",
    "synthetic-contribution-boundary",
    "synthetic-continuity",
    "synthetic-destination-routing",
    "synthetic-runtime-readiness",
    "synthetic-environment-grounding",
    "synthetic-command-discovery",
    "synthetic-capability-procedure"
  ],
  "judge": {
    "verdict": "FAIL",
    "jam": "repo-config"
  }
}
